{
  "brief_hash": "b02d8689",
  "iteration": "003",
  "stage": "refine",
  "files": [
    {
      "path": "src/main/java/com/thinking/tennis/app/AlertService.java",
      "role": "code"
    },
    {
      "path": "src/main/java/com/thinking/tennis/app/SpringConstructorWiringConfiguration.java",
      "role": "code"
    },
    {
      "path": "src/main/java/com/thinking/tennis/app/AvailabilityServiceConstructorWiringConfiguration.java",
      "role": "code"
    },
    {
      "path": "contract/tennis-alert-api-v1.yaml",
      "role": "contract"
    }
  ],
  "contract_version": {
    "path": "contract/tennis-alert-api-v1.yaml",
    "from": "contract/tennis-alert-api-v1.yaml"
  },
  "claims": [
    {
      "point": "boot:alertService",
      "note": "Keeps constructor autowiring configured for AlertService."
    },
    {
      "point": "boot:availabilityService",
      "note": "Configures constructor autowiring for AvailabilityService so Spring can resolve its existing constructor dependencies."
    }
  ],
  "decisions": [
    {
      "id": "d_spring_constructor_selection",
      "point": "boot:alertService",
      "where": "Spring bean definition registration",
      "question": "How should Spring instantiate AlertService when the service exposes multiple constructors and no constructor is explicitly annotated?",
      "considered": [
        {
          "choice": "Configure the alertService bean definition to use constructor autowiring",
          "consequence": "Spring selects a resolvable constructor without changing the service contract or adding a default constructor."
        },
        {
          "choice": "Add a default constructor",
          "consequence": "Would require inventing or manually constructing application dependencies and could leave the service improperly initialized."
        }
      ],
      "chosen": "Set constructor autowiring on the existing alertService bean definition during bean-definition post-processing.",
      "basis": "least_harm",
      "rationale": "The boot failure is caused by constructor selection, and constructor autowiring preserves the existing dependency graph and in-memory behavior.",
      "confidence": "medium",
      "blast_radius": [
        "boot:alertService"
      ],
      "reversal_cost": "Remove the constructor-wiring configuration once AlertService has an explicit Spring constructor declaration.",
      "supersedes": null
    },
    {
      "id": "d_spring_availability_constructor_selection",
      "point": "boot:availabilityService",
      "where": "Spring bean definition registration",
      "question": "How should Spring instantiate AvailabilityService when its bean definition does not enable constructor autowiring?",
      "considered": [
        {
          "choice": "Configure the availabilityService bean definition to use constructor autowiring",
          "consequence": "Spring resolves the existing constructor from registered application dependencies without adding a default constructor."
        },
        {
          "choice": "Add a default constructor",
          "consequence": "Would bypass the service's required dependencies or require inventing manual construction behavior."
        }
      ],
      "chosen": "Add a focused bean-definition post-processor that enables constructor autowiring for availabilityService.",
      "basis": "least_harm",
      "rationale": "The startup failure is specifically caused by Spring searching for a no-argument constructor; enabling constructor autowiring preserves the existing dependency graph and keeps the change isolated to boot wiring.",
      "confidence": "high",
      "blast_radius": [
        "boot:availabilityService"
      ],
      "reversal_cost": "Remove the focused wiring configuration once AvailabilityService declares an explicit Spring constructor.",
      "supersedes": null
    }
  ],
  "contract_changes": [],
  "generated_at": "2026-09-29T23:46:14+09:00",
  "model": "gpt-5.5",
  "metadata": {
    "prompt_version": "refine_impl:v1",
    "source_files": [
      "b02d8689_input.json"
    ],
    "token_usage": {
      "input_tokens": 556945,
      "cached_input_tokens": 524032,
      "output_tokens": 5955,
      "reasoning_output_tokens": 3548
    }
  },
  "commit": "70f07561cc33b43e51b3ae5d3eee28c3dd64b08b",
  "repairs": [
    {
      "violation_id": "g0.extract_failed",
      "summary": "Added constructor autowiring registration for availabilityService so the application can instantiate AvailabilityService using its existing dependencies."
    },
    {
      "violation_id": "manifest.contract_version_missing",
      "summary": "Declared contract/tennis-alert-api-v1.yaml in the file manifest."
    },
    {
      "violation_id": "manifest.contract_role_count",
      "summary": "Restored exactly one contract-role manifest entry for the active contract version."
    },
    {
      "violation_id": "manifest.undeclared_file",
      "summary": "Declared the previously changed AlertService.java in the file manifest."
    }
  ]
}
